{
  "schemaVersion": 1,
  "id": "goliathomics",
  "name": "GoliathOmics",
  "tagline": "Genomics workflows on GoliathApp: sample alignment, QC, and process packs.",
  "description": "GoliathOmics specializes the GoliathApp platform for genomics. Organization-scoped customers and clinical portal APIs live in this product's PostgreSQL domain scripts; the portal shell and semantic registry core ship with GoliathApp. A SamplePrep instance aligns each sample, runs alignment QC and extraction QC, and leaves methylation matrices for later study steps. Process packs choose analyte, library technique, and cohort on methylation, RNA-seq, or proteomics. Typed ActionSpec catalogs and worker handlers register through omics entry points; release deploy seeds the merged catalog after schema apply.",
  "category": "application",
  "features": [
    {
      "title": "SamplePrep alignment workflow",
      "description": "SamplePrepPipeline takes paired FASTQs through download, one align path, alignment QC, optional cfDNA fragmentomics, methylation extraction, extraction QC, archive, and cleanup."
    },
    {
      "title": "Four align paths",
      "description": "Linear Clara Parabricks and GoliathAlign share sample.parabricks_fq2bam and switch on actionConfig.parabricks.engine. Stock pangenome uses sample.parabricks_giraffe. WGBS pangenome uses sample.methylgrapher_wgbs_align."
    },
    {
      "title": "BAM stays on one worker",
      "description": "Align through sample.delete_bam is pinned with require_previous_worker. The BAM and staged FASTQs live on that worker's local scratch (METHYL_LOCAL_TMP), and delete_bam removes them there."
    },
    {
      "title": "QC windows with per-sample overlays",
      "description": "Alignment QC and extraction QC both honor the resolvedConfig window baked at instance start. A sample may overlay alignment core_guardrails or extraction guardrails on top of that window."
    },
    {
      "title": "Workflow JSON compiled into database nodes",
      "description": "DomainProgram JSON is compiled to a workflow definition and stored as database nodes. Starting an instance runs finalize_instance_context before the instance is created."
    },
    {
      "title": "Process packs",
      "description": "Analyte, assay-procedure, and application packs cover analytes, library techniques, and disease or trait studies for methylation, RNA-seq, and proteomics."
    },
    {
      "title": "Organization tenancy (P1b)",
      "description": "Clinical Customers carry OrganizationID into portal.Organizations. Legacy databases run the one-time 20261023_semantic_p1b_organization_cutover migration before the first P1b release apply."
    },
    {
      "title": "Typed ActionSpec catalog (O1)",
      "description": "Omics actions register as goliath.action_catalogs entry points. seed_action_catalog.py upserts merged ActionSpec rows and runtime dispatch metadata after GoliathApp and Omics schema apply."
    },
    {
      "title": "Worker gateway sessions (O2)",
      "description": "After enroll, workers open POST /v1/workers/session bearer sessions with the enrollment identity token, refresh before TTL, and call tasks with Authorization Bearer plus X-Goliath-Worker-Token."
    },
    {
      "title": "Release profiles and worker enrollment",
      "description": "A version tag builds the MethylPipeline archive, assemble publishes the GoliathOmics bundle, and deploy applies a target profile or promotes on the runner. Optional goliath_gateway and goliath_portal database role passwords are set after schema apply."
    }
  ],
  "links": {
    "repository": "https://github.com/Goliath-Research/GoliathOmics",
    "docs": "https://goliath-research.github.io/GoliathOmics/",
    "website": null
  },
  "related": ["goliathapp", "goliathalign", "goliathextractor"],
  "dependsOn": ["goliathapp", "goliathalign", "goliathextractor"],
  "license": "MIT",
  "status": "ready"
}
